{
  "$schema": "https://frameshell.dev/schema/v1/plugin.json",
  "name": "@frameshell/remotion",
  "version": "0.3.0",
  "apiVersion": "1",
  "main": "dist/index.js",
  "description": "Remotion compositions as timeline clips, rendered with your project's Remotion to VP9 WebM with alpha (ADR 0009).",
  "contributes": {
    "clipTypes": ["remotion"],
    "commands": ["remotion new"],
    "skills": ["skills/remotion/SKILL.md"]
  }
}
