{
  "$schema": "https://frameshell.dev/schema/v1/plugin.json",
  "name": "@frameshell/hyperframes",
  "version": "0.3.0",
  "apiVersion": "1",
  "main": "dist/index.js",
  "description": "HyperFrames HTML compositions as timeline clips, rendered headlessly to VP9 WebM with alpha (ADR 0002).",
  "contributes": {
    "clipTypes": ["hyperframes"],
    "commands": ["hyperframes new"],
    "skills": ["skills/hyperframes/SKILL.md"]
  }
}
